### ISSUE TITLE
Fail to downloading large enough file from aiohttp based server

### ISSUE THREAD

**Issue by iradization** [aio-libs/aiohttp#5856]
### Describe the bug

Trying to download a file of size greater than 65839, cause the http session to run for a long time without any new data being copied. 

### To Reproduce

take the following minimal server implementation 

```
import aiohttp
from aiohttp import web, WSCloseCode
import asyncio
import os

FILE_PATH = "./upgrades/file.bin"
async def http_post_handler(request):
    with open(FILE_PATH, 'rb') as f:
        fs = os.fstat(f.fileno())
        headers = {"Content-Type": 'application/octet-stream',
                   "Content-Disposition": 'attachment; filename="{}"'.format(os.path.basename(FILE_PATH)),
                   "Content-Length": str(fs.st_size)}

        return web.Response(body=f.read(), headers=headers)


def create_runner():
    app = web.Application()
    app.add_routes([
        web.post('/{post:.*}', http_post_handler),
    ])
    return web.AppRunner(app)

async def start_server(host="192.168.1.1", port=44444):
    runner = create_runner()
    await runner.setup()
    site = web.TCPSite(runner, host, port)
    await site.start()


if __name__ == "__main__":
    loop = asyncio.get_event_loop()
    loop.run_until_complete(start_server())
    loop.run_forever()
```

and on client side do : 

`curl -X POST "http://192.168.1.1:44444/post/upgrade" --output /tmp/121`

--> once where the file size is above the limit which trigger the halt
`dd if=original of=file.bin  bs=1 count=65840`

--> and another before that limit. 
`dd if=original of=file.bin  bs=1 count=65839`

Notice that if the client will run on the same machine as the server listen to address 0.0.0.0 and client connect to loopback address, the problem wouldn't occur and both actions will terminate successfully in an instant. 

Perhaps it's the file size exceed threshold of http message ? but i'd expect that even in this case, the file will be split to chunks and will be able to download. 

### Expected behavior

I except the operation to work on file size above the threshold of 65839

### Logs/tracebacks

```python-traceback
irrelevant
```

### Python Version

```console
$ python --version
Python 3.9.5
```

### aiohttp Version

```console
$ python -m pip show aiohttp
Name: aiohttp
Version: 3.7.4.post0
Summary: Async http client/server framework (asyncio)
Home-page: https://github.com/aio-libs/aiohttp
Author: Nikolay Kim
Author-email: fafhrd91@gmail.com
License: Apache 2
Location: /usr/local/lib/python3.9/site-packages
Requires: async-timeout, chardet, yarl, typing-extensions, attrs, multidict
```

### multidict Version

```console
$ python -m pip show multidict
Name: multidict
Version: 5.1.0
Summary: multidict implementation
Home-page: https://github.com/aio-libs/multidict
Author: Andrew Svetlov
Author-email: andrew.svetlov@gmail.com
License: Apache 2
Location: /usr/local/lib/python3.9/site-packages
Requires:
Required-by: yarl, aiohttp
```

### yarl Version

```console
$ python -m pip show yarl
Name: yarl
Version: 1.6.3
Summary: Yet another URL library
Home-page: https://github.com/aio-libs/yarl/
Author: Andrew Svetlov
Author-email: andrew.svetlov@gmail.com
License: Apache 2
Location: /usr/local/lib/python3.9/site-packages
Requires: idna, multidict
Required-by: aiohttp
```

### OS

macOS 11.4 (BigSur)

### Related component

Server

### Code of Conduct

- [X] I agree to follow the aio-libs Code of Conduct

**Comment by Hanaasagi** [comment]
~It can be downloaded in Linux, but it gets stuck In MacOS.~

Both test in Linux and MacOS, it can download normally.

Test Env:

- Linux 5.10.0-7-amd64 SMP Debian 5.10.40-1 (2021-05-28) x86_64 GNU/Linux 
- MacOS 11.4 Darwin Kernel Version 20.5.0

**Comment by iradization** [comment]
Sorry, I didn't understand, so if my server is running on macOS, it may get stuck ? is this a known issue ? 

my kernel version is darwin 20.4.0

**Comment by Hanaasagi** [comment]
Sorry, I find that it could run in my Mac. Please give more info about this problem.
You can use the `tcpdump -nnvXS -A -i en0 -s 0 "tcp dst port 44444"` to trace the tcp packect.

**Comment by iradization** [comment]
**Ok, so here's the output of tcpdump when the file to download from the server is 65840 bytes.**

```
M-C02F71G2MD6R:~ zkabeli$ cat /tmp/nowork
08:55:54.157436 IP (tos 0x0, ttl 64, id 0, offset 0, flags [DF], proto TCP (6), length 64)
    192.168.214.3.58704 > 192.168.214.1.44444: Flags [S], cksum 0x2f4f (correct), seq 2204425939, win 65535, options [mss 1460,nop,wscale 6,nop,nop,TS val 4111659037 ecr 0,sackOK,eol], length 0
	0x0000:  4500 0040 0000 4000 4006 0d62 c0a8 d603  E..@..@.@..b....
	0x0010:  c0a8 d601 e550 ad9c 8364 ded3 0000 0000  .....P...d......
	0x0020:  b002 ffff 2f4f 0000 0204 05b4 0103 0306  ..../O..........
	0x0030:  0101 080a f512 f01d 0000 0000 0402 0000  ................
08:55:54.158317 IP (tos 0x0, ttl 64, id 0, offset 0, flags [DF], proto TCP (6), length 52)
    192.168.214.3.58704 > 192.168.214.1.44444: Flags [.], cksum 0xec59 (correct), ack 1958891150, win 2058, options [nop,nop,TS val 4111659038 ecr 2865761417], length 0
	0x0000:  4500 0034 0000 4000 4006 0d6e c0a8 d603  E..4..@.@..n....
	0x0010:  c0a8 d601 e550 ad9c 8364 ded4 74c2 4e8e  .....P...d..t.N.
	0x0020:  8010 080a ec59 0000 0101 080a f512 f01e  .....Y..........
	0x0030:  aad0 0c89                                ....
08:55:54.159613 IP (tos 0x0, ttl 64, id 0, offset 0, flags [DF], proto TCP (6), length 148)
    192.168.214.3.58704 > 192.168.214.1.44444: Flags [P.], cksum 0x7c2b (correct), seq 2204425940:2204426036, ack 1958891150, win 2058, options [nop,nop,TS val 4111659039 ecr 2865761417], length 96
	0x0000:  4500 0094 0000 4000 4006 0d0e c0a8 d603  E.....@.@.......
	0x0010:  c0a8 d601 e550 ad9c 8364 ded4 74c2 4e8e  .....P...d..t.N.
	0x0020:  8018 080a 7c2b 0000 0101 080a f512 f01f  ....|+..........
	0x0030:  aad0 0c89 504f 5354 202f 706f 7374 2f75  ....POST./post/u
	0x0040:  7067 7261 6465 2048 5454 502f 312e 310d  pgrade.HTTP/1.1.
	0x0050:  0a48 6f73 743a 2031 3932 2e31 3638 2e32  .Host:.192.168.2
	0x0060:  3134 2e31 3a34 3434 3434 0d0a 5573 6572  14.1:44444..User
	0x0070:  2d41 6765 6e74 3a20 6375 726c 2f37 2e36  -Agent:.curl/7.6
	0x0080:  342e 310d 0a41 6363 6570 743a 202a 2f2a  4.1..Accept:.*/*
	0x0090:  0d0a 0d0a                                ....
08:55:54.161959 IP (tos 0x0, ttl 64, id 0, offset 0, flags [DF], proto TCP (6), length 52)
    192.168.214.3.58704 > 192.168.214.1.44444: Flags [.], cksum 0xe464 (correct), ack 1958893115, win 2028, options [nop,nop,TS val 4111659041 ecr 2865761420], length 0
	0x0000:  4500 0034 0000 4000 4006 0d6e c0a8 d603  E..4..@.@..n....
	0x0010:  c0a8 d601 e550 ad9c 8364 df34 74c2 563b  .....P...d.4t.V;
	0x0020:  8010 07ec e464 0000 0101 080a f512 f021  .....d.........!
	0x0030:  aad0 0c8c                                ....
08:55:54.162905 IP (tos 0x0, ttl 64, id 0, offset 0, flags [DF], proto TCP (6), length 52)
    192.168.214.3.58704 > 192.168.214.1.44444: Flags [.], cksum 0xb234 (correct), ack 1958906147, win 1844, options [nop,nop,TS val 4111659041 ecr 2865761420], length 0
	0x0000:  4500 0034 0000 4000 4006 0d6e c0a8 d603  E..4..@.@..n....
	0x0010:  c0a8 d601 e550 ad9c 8364 df34 74c2 8923  .....P...d.4t..#
	0x0020:  8010 0734 b234 0000 0101 080a f512 f021  ...4.4.........!
	0x0030:  aad0 0c8c                                ....
08:55:54.163596 IP (tos 0x0, ttl 64, id 0, offset 0, flags [DF], proto TCP (6), length 52)
    192.168.214.3.58704 > 192.168.214.1.44444: Flags [.], cksum 0xb167 (correct), ack 1958906147, win 2048, options [nop,nop,TS val 4111659042 ecr 2865761420], length 0
	0x0000:  4500 0034 0000 4000 4006 0d6e c0a8 d603  E..4..@.@..n....
	0x0010:  c0a8 d601 e550 ad9c 8364 df34 74c2 8923  .....P...d.4t..#
	0x0020:  8010 0800 b167 0000 0101 080a f512 f022  .....g........."
	0x0030:  aad0 0c8c                                ....
08:55:54.164303 IP (tos 0x0, ttl 64, id 0, offset 0, flags [DF], proto TCP (6), length 52)
    192.168.214.3.58704 > 192.168.214.1.44444: Flags [.], cksum 0x7426 (correct), ack 1958922075, win 1799, options [nop,nop,TS val 4111659043 ecr 2865761421], length 0
	0x0000:  4500 0034 0000 4000 4006 0d6e c0a8 d603  E..4..@.@..n....
	0x0010:  c0a8 d601 e550 ad9c 8364 df34 74c2 c75b  .....P...d.4t..[
	0x0020:  8010 0707 7426 0000 0101 080a f512 f023  ....t&.........#
	0x0030:  aad0 0c8d                                ....
08:55:54.164370 IP (tos 0x0, ttl 64, id 0, offset 0, flags [DF], proto TCP (6), length 52)
    192.168.214.3.58704 > 192.168.214.1.44444: Flags [.], cksum 0x4d2d (correct), ack 1958932211, win 1640, options [nop,nop,TS val 4111659043 ecr 2865761421], length 0
	0x0000:  4500 0034 0000 4000 4006 0d6e c0a8 d603  E..4..@.@..n....
	0x0010:  c0a8 d601 e550 ad9c 8364 df34 74c2 eef3  .....P...d.4t...
	0x0020:  8010 0668 4d2d 0000 0101 080a f512 f023  ...hM-.........#
	0x0030:  aad0 0c8d                                ....
08:55:54.164481 IP (tos 0x0, ttl 64, id 0, offset 0, flags [DF], proto TCP (6), length 52)
    192.168.214.3.58704 > 192.168.214.1.44444: Flags [.], cksum 0x4b95 (correct), ack 1958932211, win 2048, options [nop,nop,TS val 4111659043 ecr 2865761421], length 0
	0x0000:  4500 0034 0000 4000 4006 0d6e c0a8 d603  E..4..@.@..n....
	0x0010:  c0a8 d601 e550 ad9c 8364 df34 74c2 eef3  .....P...d.4t...
	0x0020:  8010 0800 4b95 0000 0101 080a f512 f023  ....K..........#
	0x0030:  aad0 0c8d                                ....
08:55:54.165632 IP (tos 0x0, ttl 64, id 0, offset 0, flags [DF], proto TCP (6), length 52)
    192.168.214.3.58704 > 192.168.214.1.44444: Flags [.], cksum 0x0e54 (correct), ack 1958948139, win 1799, options [nop,nop,TS val 4111659044 ecr 2865761422], length 0
	0x0000:  4500 0034 0000 4000 4006 0d6e c0a8 d603  E..4..@.@..n....
	0x0010:  c0a8 d601 e550 ad9c 8364 df34 74c3 2d2b  .....P...d.4t.-+
	0x0020:  8010 0707 0e54 0000 0101 080a f512 f024  .....T.........$
	0x0030:  aad0 0c8e                                ....
08:55:54.165645 IP (tos 0x0, ttl 64, id 0, offset 0, flags [DF], proto TCP (6), length 52)
    192.168.214.3.58704 > 192.168.214.1.44444: Flags [.], cksum 0xeb79 (correct), ack 1958957203, win 1657, options [nop,nop,TS val 4111659044 ecr 2865761422], length 0
	0x0000:  4500 0034 0000 4000 4006 0d6e c0a8 d603  E..4..@.@..n....
	0x0010:  c0a8 d601 e550 ad9c 8364 df34 74c3 5093  .....P...d.4t.P.
	0x0020:  8010 0679 eb79 0000 0101 080a f512 f024  ...y.y.........$
	0x0030:  aad0 0c8e                                ....
08:55:54.165650 IP (tos 0x0, ttl 64, id 0, offset 0, flags [DF], proto TCP (6), length 52)
    192.168.214.3.58704 > 192.168.214.1.44444: Flags [.], cksum 0xe9f2 (correct), ack 1958957203, win 2048, options [nop,nop,TS val 4111659044 ecr 2865761422], length 0
	0x0000:  4500 0034 0000 4000 4006 0d6e c0a8 d603  E..4..@.@..n....
	0x0010:  c0a8 d601 e550 ad9c 8364 df34 74c3 5093  .....P...d.4t.P.
	0x0020:  8010 0800 e9f2 0000 0101 080a f512 f024  ...............$
	0x0030:  aad0 0c8e                                ....
08:56:54.268078 IP (tos 0x0, ttl 64, id 16220, offset 0, flags [none], proto TCP (6), length 40)
    192.168.214.3.58704 > 192.168.214.1.44444: Flags [.], cksum 0xbfa1 (correct), ack 1958957203, win 2048, length 0
	0x0000:  4500 0028 3f5c 0000 4006 0e1e c0a8 d603  E..(?\..@.......
	0x0010:  c0a8 d601 e550 ad9c 8364 df33 74c3 5093  .....P...d.3t.P.
	0x0020:  5010 0800 bfa1 0000                      P.......
08:57:09.167028 IP (tos 0x0, ttl 64, id 0, offset 0, flags [DF], proto TCP (6), length 52)
    192.168.214.3.58704 > 192.168.214.1.44444: Flags [.], cksum 0xa1b8 (correct), ack 1958957204, win 2048, options [nop,nop,TS val 4111733920 ecr 2865836105], length 0
	0x0000:  4500 0034 0000 4000 4006 0d6e c0a8 d603  E..4..@.@..n....
	0x0010:  c0a8 d601 e550 ad9c 8364 df34 74c3 5094  .....P...d.4t.P.
	0x0020:  8010 0800 a1b8 0000 0101 080a f514 14a0  ................
	0x0030:  aad1 3049                                ..0I
08:57:09.168839 IP (tos 0x0, ttl 64, id 0, offset 0, flags [DF], proto TCP (6), length 52)
    192.168.214.3.58704 > 192.168.214.1.44444: Flags [F.], cksum 0xa1b6 (correct), seq 2204426036, ack 1958957204, win 2048, options [nop,nop,TS val 4111733921 ecr 2865836105], length 0
	0x0000:  4500 0034 0000 4000 4006 0d6e c0a8 d603  E..4..@.@..n....
	0x0010:  c0a8 d601 e550 ad9c 8364 df34 74c3 5094  .....P...d.4t.P.
	0x0020:  8011 0800 a1b6 0000 0101 080a f514 14a1  ................
	0x0030:  aad1 3049                                ..0I
```

**and here's the output when the file to download size 65839:**

```
08:59:44.918688 IP (tos 0x0, ttl 64, id 0, offset 0, flags [DF], proto TCP (6), length 64)
    192.168.214.3.58705 > 192.168.214.1.44444: Flags [S], cksum 0x76fa (correct), seq 1283469647, win 65535, options [mss 1460,nop,wscale 6,nop,nop,TS val 3514085496 ecr 0,sackOK,eol], length 0
	0x0000:  4500 0040 0000 4000 4006 0d62 c0a8 d603  E..@..@.@..b....
	0x0010:  c0a8 d601 e551 ad9c 4c80 314f 0000 0000  .....Q..L.1O....
	0x0020:  b002 ffff 76fa 0000 0204 05b4 0103 0306  ....v...........
	0x0030:  0101 080a d174 b078 0000 0000 0402 0000  .....t.x........
08:59:44.921263 IP (tos 0x0, ttl 64, id 0, offset 0, flags [DF], proto TCP (6), length 52)
    192.168.214.3.58705 > 192.168.214.1.44444: Flags [.], cksum 0x4ec6 (correct), ack 3323595150, win 2058, options [nop,nop,TS val 3514085498 ecr 667641972], length 0
	0x0000:  4500 0034 0000 4000 4006 0d6e c0a8 d603  E..4..@.@..n....
	0x0010:  c0a8 d601 e551 ad9c 4c80 3150 c61a 098e  .....Q..L.1P....
	0x0020:  8010 080a 4ec6 0000 0101 080a d174 b07a  ....N........t.z
	0x0030:  27cb 6874                                '.ht
08:59:44.921316 IP (tos 0x0, ttl 64, id 0, offset 0, flags [DF], proto TCP (6), length 148)
    192.168.214.3.58705 > 192.168.214.1.44444: Flags [P.], cksum 0xde98 (correct), seq 1283469648:1283469744, ack 3323595150, win 2058, options [nop,nop,TS val 3514085498 ecr 667641972], length 96
	0x0000:  4500 0094 0000 4000 4006 0d0e c0a8 d603  E.....@.@.......
	0x0010:  c0a8 d601 e551 ad9c 4c80 3150 c61a 098e  .....Q..L.1P....
	0x0020:  8018 080a de98 0000 0101 080a d174 b07a  .............t.z
	0x0030:  27cb 6874 504f 5354 202f 706f 7374 2f75  '.htPOST./post/u
	0x0040:  7067 7261 6465 2048 5454 502f 312e 310d  pgrade.HTTP/1.1.
	0x0050:  0a48 6f73 743a 2031 3932 2e31 3638 2e32  .Host:.192.168.2
	0x0060:  3134 2e31 3a34 3434 3434 0d0a 5573 6572  14.1:44444..User
	0x0070:  2d41 6765 6e74 3a20 6375 726c 2f37 2e36  -Agent:.curl/7.6
	0x0080:  342e 310d 0a41 6363 6570 743a 202a 2f2a  4.1..Accept:.*/*
	0x0090:  0d0a 0d0a                                ....
08:59:44.924878 IP (tos 0x0, ttl 64, id 0, offset 0, flags [DF], proto TCP (6), length 52)
    192.168.214.3.58705 > 192.168.214.1.44444: Flags [.], cksum 0x2694 (correct), ack 3323605499, win 1897, options [nop,nop,TS val 3514085500 ecr 667641976], length 0
	0x0000:  4500 0034 0000 4000 4006 0d6e c0a8 d603  E..4..@.@..n....
	0x0010:  c0a8 d601 e551 ad9c 4c80 31b0 c61a 31fb  .....Q..L.1...1.
	0x0020:  8010 0769 2694 0000 0101 080a d174 b07c  ...i&........t.|
	0x0030:  27cb 6878                                '.hx
08:59:44.924955 IP (tos 0x0, ttl 64, id 0, offset 0, flags [DF], proto TCP (6), length 52)
    192.168.214.3.58705 > 192.168.214.1.44444: Flags [.], cksum 0x25fd (correct), ack 3323605499, win 2048, options [nop,nop,TS val 3514085500 ecr 667641976], length 0
	0x0000:  4500 0034 0000 4000 4006 0d6e c0a8 d603  E..4..@.@..n....
	0x0010:  c0a8 d601 e551 ad9c 4c80 31b0 c61a 31fb  .....Q..L.1...1.
	0x0020:  8010 0800 25fd 0000 0101 080a d174 b07c  ....%........t.|
	0x0030:  27cb 6878                                '.hx
08:59:44.926497 IP (tos 0x0, ttl 64, id 0, offset 0, flags [DF], proto TCP (6), length 52)
    192.168.214.3.58705 > 192.168.214.1.44444: Flags [.], cksum 0xe8bb (correct), ack 3323621427, win 1799, options [nop,nop,TS val 3514085501 ecr 667641977], length 0
	0x0000:  4500 0034 0000 4000 4006 0d6e c0a8 d603  E..4..@.@..n....
	0x0010:  c0a8 d601 e551 ad9c 4c80 31b0 c61a 7033  .....Q..L.1...p3
	0x0020:  8010 0707 e8bb 0000 0101 080a d174 b07d  .............t.}
	0x0030:  27cb 6879                                '.hy
08:59:44.927174 IP (tos 0x0, ttl 64, id 0, offset 0, flags [DF], proto TCP (6), length 52)
    192.168.214.3.58705 > 192.168.214.1.44444: Flags [.], cksum 0xd276 (correct), ack 3323627219, win 1708, options [nop,nop,TS val 3514085501 ecr 667641977], length 0
	0x0000:  4500 0034 0000 4000 4006 0d6e c0a8 d603  E..4..@.@..n....
	0x0010:  c0a8 d601 e551 ad9c 4c80 31b0 c61a 86d3  .....Q..L.1.....
	0x0020:  8010 06ac d276 0000 0101 080a d174 b07d  .....v.......t.}
	0x0030:  27cb 6879                                '.hy
08:59:44.927213 IP (tos 0x0, ttl 64, id 0, offset 0, flags [DF], proto TCP (6), length 52)
    192.168.214.3.58705 > 192.168.214.1.44444: Flags [.], cksum 0xd122 (correct), ack 3323627219, win 2048, options [nop,nop,TS val 3514085501 ecr 667641977], length 0
	0x0000:  4500 0034 0000 4000 4006 0d6e c0a8 d603  E..4..@.@..n....
	0x0010:  c0a8 d601 e551 ad9c 4c80 31b0 c61a 86d3  .....Q..L.1.....
	0x0020:  8010 0800 d122 0000 0101 080a d174 b07d  .....".......t.}
	0x0030:  27cb 6879                                '.hy
08:59:44.927644 IP (tos 0x0, ttl 64, id 0, offset 0, flags [DF], proto TCP (6), length 52)
    192.168.214.3.58705 > 192.168.214.1.44444: Flags [.], cksum 0x93e2 (correct), ack 3323643147, win 1799, options [nop,nop,TS val 3514085501 ecr 667641978], length 0
	0x0000:  4500 0034 0000 4000 4006 0d6e c0a8 d603  E..4..@.@..n....
	0x0010:  c0a8 d601 e551 ad9c 4c80 31b0 c61a c50b  .....Q..L.1.....
	0x0020:  8010 0707 93e2 0000 0101 080a d174 b07d  .............t.}
	0x0030:  27cb 687a                                '.hz
08:59:44.927656 IP (tos 0x0, ttl 64, id 0, offset 0, flags [DF], proto TCP (6), length 52)
    192.168.214.3.58705 > 192.168.214.1.44444: Flags [.], cksum 0x5c35 (correct), ack 3323657627, win 1572, options [nop,nop,TS val 3514085501 ecr 667641978], length 0
	0x0000:  4500 0034 0000 4000 4006 0d6e c0a8 d603  E..4..@.@..n....
	0x0010:  c0a8 d601 e551 ad9c 4c80 31b0 c61a fd9b  .....Q..L.1.....
	0x0020:  8010 0624 5c35 0000 0101 080a d174 b07d  ...$\5.......t.}
	0x0030:  27cb 687a                                '.hz
08:59:44.927661 IP (tos 0x0, ttl 64, id 0, offset 0, flags [DF], proto TCP (6), length 52)
    192.168.214.3.58705 > 192.168.214.1.44444: Flags [.], cksum 0x5a58 (correct), ack 3323657627, win 2048, options [nop,nop,TS val 3514085502 ecr 667641978], length 0
	0x0000:  4500 0034 0000 4000 4006 0d6e c0a8 d603  E..4..@.@..n....
	0x0010:  c0a8 d601 e551 ad9c 4c80 31b0 c61a fd9b  .....Q..L.1.....
	0x0020:  8010 0800 5a58 0000 0101 080a d174 b07e  ....ZX.......t.~
	0x0030:  27cb 687a                                '.hz
08:59:44.928507 IP (tos 0x0, ttl 64, id 0, offset 0, flags [DF], proto TCP (6), length 52)
    192.168.214.3.58705 > 192.168.214.1.44444: Flags [.], cksum 0x4c98 (correct), ack 3323661202, win 1992, options [nop,nop,TS val 3514085503 ecr 667641978], length 0
	0x0000:  4500 0034 0000 4000 4006 0d6e c0a8 d603  E..4..@.@..n....
	0x0010:  c0a8 d601 e551 ad9c 4c80 31b0 c61b 0b92  .....Q..L.1.....
	0x0020:  8010 07c8 4c98 0000 0101 080a d174 b07f  ....L........t..
	0x0030:  27cb 687a                                '.hz
08:59:44.928649 IP (tos 0x0, ttl 64, id 0, offset 0, flags [DF], proto TCP (6), length 52)
    192.168.214.3.58705 > 192.168.214.1.44444: Flags [.], cksum 0x4c60 (correct), ack 3323661202, win 2048, options [nop,nop,TS val 3514085503 ecr 667641978], length 0
	0x0000:  4500 0034 0000 4000 4006 0d6e c0a8 d603  E..4..@.@..n....
	0x0010:  c0a8 d601 e551 ad9c 4c80 31b0 c61b 0b92  .....Q..L.1.....
	0x0020:  8010 0800 4c60 0000 0101 080a d174 b07f  ....L`.......t..
	0x0030:  27cb 687a                                '.hz
08:59:44.931037 IP (tos 0x0, ttl 64, id 0, offset 0, flags [DF], proto TCP (6), length 52)
    192.168.214.3.58705 > 192.168.214.1.44444: Flags [F.], cksum 0x4c5d (correct), seq 1283469744, ack 3323661202, win 2048, options [nop,nop,TS val 3514085505 ecr 667641978], length 0
	0x0000:  4500 0034 0000 4000 4006 0d6e c0a8 d603  E..4..@.@..n....
	0x0010:  c0a8 d601 e551 ad9c 4c80 31b0 c61b 0b92  .....Q..L.1.....
	0x0020:  8011 0800 4c5d 0000 0101 080a d174 b081  ....L].......t..
	0x0030:  27cb 687a                                '.hz
08:59:44.933285 IP (tos 0x0, ttl 64, id 0, offset 0, flags [DF], proto TCP (6), length 52)
    192.168.214.3.58705 > 192.168.214.1.44444: Flags [.], cksum 0x4c56 (correct), ack 3323661203, win 2048, options [nop,nop,TS val 3514085507 ecr 667641982], length 0
	0x0000:  4500 0034 0000 4000 4006 0d6e c0a8 d603  E..4..@.@..n....
	0x0010:  c0a8 d601 e551 ad9c 4c80 31b1 c61b 0b93  .....Q..L.1.....
	0x0020:  8010 0800 4c56 0000 0101 080a d174 b083  ....LV.......t..
	0x0030:  27cb 687e                                '.h~
```

**Comment by Hanaasagi** [comment]
:sweat_smile: I don't find the root cause of the problem. Maybe you can try `StreamResponse`

```Python
FILE_PATH = "./upgrades/file.bin"
async def http_post_handler(request):
    with open(FILE_PATH, 'rb') as f:
        fs = os.fstat(f.fileno())
        headers = {"Content-Type": 'application/octet-stream',
                   "Content-Disposition": 'attachment; filename="{}"'.format(os.path.basename(FILE_PATH)),
                   "Content-Length": str(fs.st_size)}
        response = web.StreamResponse(
            status=200,
            reason='OK',
            headers=headers,
        )
        await response.prepare(request)
        while True:
            data = f.read(1024)
            if len(data) == 0:
                break
            await response.write(data)
    await response.write_eof()
```

**Comment by iradization** [comment]
At first glance it seem to be working ! 

I'll try to investigate some about the difference between StreamResponse and regular response to understand the root cause. 

Thanks !

**Comment by Hanaasagi** [comment]
After searching `macos big sur 65839` in google. There are some related issues, such as [this, long string was truncated if length > 65839 when sending to server](https://github.com/pgjdbc/pgjdbc/issues/2177). Please check your local network configuration.
