### ISSUE TITLE
Multi packet POST request triggers `invalid HTTP method`

### ISSUE THREAD

**Issue by iradization** [aio-libs/aiohttp#5832]
### Describe the bug

I've got a client based on python3 native package `http.client.HTTPConnection` and a server that based on aiohttp.web. When I send http request from client, it seem to split the http command into 2 parts, one for the headers and another one for the body (represented by the json {"current_config": "bla"})

```
05:12:46.836684 IP 192.168.214.3.54490 > 192.168.214.1.44444: Flags [P.], seq 3569091528:3569091688, ack 1310633655, win 2058, options [nop,nop,TS val 2463825816 ecr 3230996309], length 160
.fZ.7d..).....E.....@.@...................N......
.......
.......UPOST /keepalive HTTP/1.1
Host: 192.168.214.1:444
Accept-Encoding: identity
Content-type: application/json
Accept: application/json
Content-Length: 20


05:12:46.836756 IP 192.168.214.3.54490 > 192.168.214.1.44444: Flags [P.], seq 160:185, ack 1, win 2058, options [nop,nop,TS val 2463825816 ecr 3230996309], length 25
.fZ.7d..).....E..M..@.@..................hN......
-......
.......U{"param0":"pradeep"}
```

This triggers the following error on server side :

```
Traceback (most recent call last):
file "/usr/local/lib/python3.9/site-packages/aiohttp/web_protocol.py", line 314, in data_received
messages, upgraded, tail = self._request_parser.feed_data(data)
File "aiohttp/_http_parser.pyx", line 546, in aiohttp._http_parser.HttpParser.feed_data
aiohttp.http_exceptions.BadStatusLine: 400, message="Bad status line 'invalid HTTP method'"````
```

But when sending roughly the same POST  command using curl which doesn't split between the body and headers in different packets , the server replies as expected :
Here's the POST command generated from POST  request :

```
05:19:47.514910 IP 192.168.214.3.54514 > 192.168.214.1.44444: Flags [P.], seq 219979840:219980013, ack 3474705214, win 2058, options [nop,nop,TS val 3057096618 ecr 2210798047], length 173
.fZ.7d..).....E.....@.@..................@...>...
.*.....
.7......POST /post HTTP/1.1
Host: 192.168.214.1:44444
User-Agent: curl/7.64.1
Content-type: application/json
Accept: application/json
Content-Length: 20

{"param0":"pradeep"}
```

### To Reproduce

simple server based on aiohttp with support on post requests 

1. send post command using curl 
2. send the same command using http.client.HTTPConnection

### Expected behavior

Post request should be properly receive by the server on both cases. 

### Logs/tracebacks

```python-traceback
packet trace and callstack are given in the bug description.
```

### Python Version

```console
$ python --version
python 3.9.5
```

### aiohttp Version

```console
$ python -m pip show aiohttp
M-C02F71G2MD6R:mac zkabeli$ python3 -m pip show aiohttp
Name: aiohttp
Version: 3.7.4.post0
Summary: Async http client/server framework (asyncio)
Home-page: https://github.com/aio-libs/aiohttp
Author: Nikolay Kim
Author-email: fafhrd91@gmail.com
License: Apache 2
Location: /usr/local/lib/python3.9/site-packages
Requires: typing-extensions, yarl, chardet, async-timeout, attrs, multidict
```

### multidict Version

```console
$ python -m pip show multidict
```

### yarl Version

```console
$ python -m pip show yarl
Name: multidict
Version: 5.1.0
Summary: multidict implementation
Home-page: https://github.com/aio-libs/multidict
Author: Andrew Svetlov
Author-email: andrew.svetlov@gmail.com
License: Apache 2
Location: /usr/local/lib/python3.9/site-packages
Requires:
Required-by: yarl, aiohttp
```

### OS

macOS

### Related component

Server

### Code of Conduct

- [X] I agree to follow the aio-libs Code of Conduct

**Comment by Hanaasagi** [comment]
I try a minimal client/server in Python 3.9.2(Linux 5.10.40-1). And reset the TCP MSS to force split packet. I could not reproduce this problem.

 
Server:
```Python
import json
from aiohttp import web


async def handle(request):
    data = await request.json()
    return web.Response(text=json.dumps(data))


app = web.Application()
app.add_routes([web.post('/', handle)])

if __name__ == '__main__':
    web.run_app(app)

```

Client:
```Python
import http.client
import json

connection = http.client.HTTPConnection('127.0.0.1:8080')

headers = {'Content-type': 'application/json'}

data = {'a': 'b', 'c': 'd'}

connection.request('POST', '/', json.dumps(data), headers)

response = connection.getresponse()
print(response.read().decode())
```

**Comment by Hanaasagi** [comment]
> .......UPOST /keepalive HTTP/1.1

@iradization  Emm, It has `U` in the HTTP Start Line before `POST`. I think this is the real cause.

**Comment by iradization** [comment]
yes, The 'U' is definitely unattached to the POST request so in either way, it's not something To do with the aiohttp server. Thanks for the observation :-) 
closing ...
